{
  "schema_version": "1.0",
  "id": "ir-e1d09cd5acb4",
  "created_at": "2026-09-25T12:00:00.000Z",
  "sources": [
    {
      "id": "src-1",
      "kind": "text",
      "uri": "inline:inline-3a38727ca4e1",
      "sha256": "3a38727ca4e12a486143c2de8c1d14a48065be9ed7b76a513abcd40b870021ae",
      "title": "Why teams adopt edge caching"
    }
  ],
  "sections": [
    {
      "id": "sec-1",
      "source_id": "src-1",
      "heading": "Why teams adopt edge caching",
      "text": "Edge caching moves content closer to users. A regional cache in front of an origin can cut median response time from 180 ms to 35 ms."
    },
    {
      "id": "sec-2",
      "source_id": "src-1",
      "heading": "Costs",
      "text": "Egress from the origin fell by 62% in the first quarter after rollout, saving about $14,000 per month."
    }
  ],
  "evidence": [
    {
      "ref": "text:inline-3a38727ca4e1#c30-163",
      "source_id": "src-1",
      "text": "Edge caching moves content closer to users. A regional cache in front of an\norigin can cut median response time from 180 ms to 35 ms.",
      "locator": {
        "line_start": 3,
        "line_end": 4,
        "selector": "#why-teams-adopt-edge-caching",
        "char_start": 30,
        "char_end": 163
      }
    },
    {
      "ref": "text:inline-3a38727ca4e1#c172-274",
      "source_id": "src-1",
      "text": "Egress from the origin fell by 62% in the first quarter after rollout, saving\nabout $14,000 per month.",
      "locator": {
        "line_start": 8,
        "line_end": 9,
        "selector": "#costs",
        "char_start": 172,
        "char_end": 274
      }
    }
  ],
  "entities": [],
  "claims": [
    {
      "id": "claim-1",
      "text": "A regional cache in front of an origin can cut median response time from 180 ms to 35 ms.",
      "kind": "quantitative",
      "evidence_refs": [
        "text:inline-3a38727ca4e1#c30-163"
      ]
    },
    {
      "id": "claim-2",
      "text": "Egress from the origin fell by 62% in the first quarter after rollout, saving about $14,000 per month.",
      "kind": "quantitative",
      "evidence_refs": [
        "text:inline-3a38727ca4e1#c172-274"
      ]
    }
  ],
  "assets": [],
  "classification": {
    "contains_secrets": false,
    "contains_pii": false,
    "contains_likeness": false,
    "data_class": "internal",
    "notes": []
  },
  "warnings": []
}
