{
  "schema_version": "1.0",
  "id": "ir-e3f9ab6591ac",
  "created_at": "2026-09-25T12:00:00.000Z",
  "sources": [
    {
      "id": "src-1",
      "kind": "pptx",
      "uri": "<repo>/fixtures/docs/sample.pptx",
      "sha256": "668fb74e39f01085122cdefac6a293f59c657e1dd9e0cb44848e1ad3f9a1240a",
      "title": "Vector DB Deck"
    }
  ],
  "sections": [
    {
      "id": "sec-1",
      "source_id": "src-1",
      "heading": "Vector Databases",
      "text": "A 30-second explainer"
    },
    {
      "id": "sec-2",
      "source_id": "src-1",
      "heading": "How it works",
      "text": "Embed the data\n\nIndex with HNSW\n\nQuery by similarity"
    },
    {
      "id": "sec-3",
      "source_id": "src-1",
      "heading": "Results",
      "text": "Latency fell 42%"
    }
  ],
  "evidence": [
    {
      "ref": "pptx:sample.pptx#s1.para-1",
      "source_id": "src-1",
      "text": "Vector Databases",
      "locator": {
        "slide": 1
      }
    },
    {
      "ref": "pptx:sample.pptx#s1.para-2",
      "source_id": "src-1",
      "text": "A 30-second explainer",
      "locator": {
        "slide": 1
      }
    },
    {
      "ref": "pptx:sample.pptx#s1.notes",
      "source_id": "src-1",
      "text": "Open with the problem: keyword search misses meaning.",
      "locator": {
        "slide": 1,
        "selector": "notes"
      }
    },
    {
      "ref": "pptx:sample.pptx#s2.para-1",
      "source_id": "src-1",
      "text": "How it works",
      "locator": {
        "slide": 2
      }
    },
    {
      "ref": "pptx:sample.pptx#s2.para-2",
      "source_id": "src-1",
      "text": "Embed the data",
      "locator": {
        "slide": 2
      }
    },
    {
      "ref": "pptx:sample.pptx#s2.para-3",
      "source_id": "src-1",
      "text": "Index with HNSW",
      "locator": {
        "slide": 2
      }
    },
    {
      "ref": "pptx:sample.pptx#s2.para-4",
      "source_id": "src-1",
      "text": "Query by similarity",
      "locator": {
        "slide": 2
      }
    },
    {
      "ref": "pptx:sample.pptx#s2.notes",
      "source_id": "src-1",
      "text": "Mention that HNSW is a graph index.",
      "locator": {
        "slide": 2,
        "selector": "notes"
      }
    },
    {
      "ref": "pptx:sample.pptx#s3.para-1",
      "source_id": "src-1",
      "text": "Results",
      "locator": {
        "slide": 3
      }
    },
    {
      "ref": "pptx:sample.pptx#s3.para-2",
      "source_id": "src-1",
      "text": "Latency fell 42%",
      "locator": {
        "slide": 3
      }
    },
    {
      "ref": "pptx:sample.pptx#s3.notes",
      "source_id": "src-1",
      "text": "Close with the call to action.",
      "locator": {
        "slide": 3,
        "selector": "notes"
      }
    }
  ],
  "entities": [
    {
      "id": "ent-1",
      "name": "DB",
      "kind": "technology",
      "evidence_refs": [
        "pptx:sample.pptx#s1.para-1"
      ]
    }
  ],
  "claims": [
    {
      "id": "claim-1",
      "text": "Latency fell 42%",
      "kind": "quantitative",
      "evidence_refs": [
        "pptx:sample.pptx#s3.para-2"
      ]
    }
  ],
  "assets": [
    {
      "id": "asset-1",
      "kind": "image",
      "path": "source/assets/fdf040aaee9270aef6cf03752d51615cf6025c72081820fe0945f0c9c9cbdd9c.png",
      "sha256": "fdf040aaee9270aef6cf03752d51615cf6025c72081820fe0945f0c9c9cbdd9c",
      "source_ref": "pptx:sample.pptx#s2"
    }
  ],
  "classification": {
    "contains_secrets": false,
    "contains_pii": false,
    "contains_likeness": false,
    "data_class": "internal",
    "notes": []
  },
  "warnings": []
}
