{
  "schema_version": "1.0",
  "id": "ir-4514ae384e41",
  "created_at": "2026-09-25T12:00:00.000Z",
  "sources": [
    {
      "id": "src-1",
      "kind": "markdown",
      "uri": "<repo>/fixtures/golden/article.md",
      "sha256": "79ed2f3849dc479e78f67f4d82a30c81768b2692f6494bc98a3fcfa69c630452",
      "title": "Five lessons from migrating to Postgres 17"
    }
  ],
  "sections": [
    {
      "id": "sec-1",
      "source_id": "src-1",
      "heading": "Five lessons from migrating to Postgres 17",
      "text": "We moved 40 services from MySQL to Postgres over six months. This post collects what we learned."
    },
    {
      "id": "sec-2",
      "source_id": "src-1",
      "heading": "Plan the cutover",
      "text": "Dual writes ran for 3 weeks before we switched reads. Replication lag stayed under 200 ms at the 99th percentile."
    },
    {
      "id": "sec-3",
      "source_id": "src-1",
      "heading": "Measure everything",
      "text": "- Query latency dropped 27% after enabling parallel sequential scans.\n- Storage grew 15% because of wider indexes."
    },
    {
      "id": "sec-4",
      "source_id": "src-1",
      "heading": "Keep rollback cheap",
      "text": "A migration you cannot roll back is a bet, not a plan.\n\nEvery step had a documented rollback, and we used it twice."
    }
  ],
  "evidence": [
    {
      "ref": "markdown:article.md#L3-L4",
      "source_id": "src-1",
      "text": "We moved 40 services from MySQL to Postgres over six months. This post\ncollects what we learned.",
      "locator": {
        "line_start": 3,
        "line_end": 4,
        "selector": "#five-lessons-from-migrating-to-postgres-17",
        "char_start": 46,
        "char_end": 142
      }
    },
    {
      "ref": "markdown:article.md#L8-L9",
      "source_id": "src-1",
      "text": "Dual writes ran for 3 weeks before we switched reads. Replication lag stayed\nunder 200 ms at the 99th percentile.",
      "locator": {
        "line_start": 8,
        "line_end": 9,
        "selector": "#plan-the-cutover",
        "char_start": 165,
        "char_end": 278
      }
    },
    {
      "ref": "markdown:article.md#L13-L14",
      "source_id": "src-1",
      "text": "- Query latency dropped 27% after enabling parallel sequential scans.\n- Storage grew 15% because of wider indexes.",
      "locator": {
        "line_start": 13,
        "line_end": 14,
        "selector": "#measure-everything",
        "char_start": 303,
        "char_end": 417
      }
    },
    {
      "ref": "markdown:article.md#L18",
      "source_id": "src-1",
      "text": "> A migration you cannot roll back is a bet, not a plan.",
      "locator": {
        "line_start": 18,
        "line_end": 18,
        "selector": "#keep-rollback-cheap",
        "char_start": 443,
        "char_end": 499
      }
    },
    {
      "ref": "markdown:article.md#L20",
      "source_id": "src-1",
      "text": "Every step had a documented rollback, and we used it twice.",
      "locator": {
        "line_start": 20,
        "line_end": 20,
        "selector": "#keep-rollback-cheap",
        "char_start": 501,
        "char_end": 560
      }
    }
  ],
  "entities": [],
  "claims": [
    {
      "id": "claim-1",
      "text": "We moved 40 services from MySQL to Postgres over six months.",
      "kind": "quantitative",
      "evidence_refs": [
        "markdown:article.md#L3-L4"
      ]
    },
    {
      "id": "claim-2",
      "text": "Dual writes ran for 3 weeks before we switched reads.",
      "kind": "quantitative",
      "evidence_refs": [
        "markdown:article.md#L8-L9"
      ]
    },
    {
      "id": "claim-3",
      "text": "Replication lag stayed under 200 ms at the 99th percentile.",
      "kind": "quantitative",
      "evidence_refs": [
        "markdown:article.md#L8-L9"
      ]
    },
    {
      "id": "claim-4",
      "text": "Query latency dropped 27% after enabling parallel sequential scans.",
      "kind": "quantitative",
      "evidence_refs": [
        "markdown:article.md#L13-L14"
      ]
    },
    {
      "id": "claim-5",
      "text": "Storage grew 15% because of wider indexes.",
      "kind": "quantitative",
      "evidence_refs": [
        "markdown:article.md#L13-L14"
      ]
    }
  ],
  "assets": [],
  "classification": {
    "contains_secrets": false,
    "contains_pii": false,
    "contains_likeness": false,
    "data_class": "internal",
    "notes": []
  },
  "warnings": []
}
